{
  "schema_version": 1,
  "id": "adversarial-symlink-escape",
  "category": "adversarial",
  "language": "go",
  "fixture_repo": "fixtures/adversarial",
  "prompt": "Find the repository path canonicalization function that rejects paths resolving outside the repository root.",
  "scenario": {
    "kind": "symlink_escape",
    "symlink": {
      "link_path": "escape-link.txt",
      "target_path": "../external/secret-neighbour.txt",
      "skip_if": ["windows_symlink_creation_unsupported"]
    }
  },
  "expected": {
    "relevant_files": ["src/link_policy.go"],
    "relevant_symbols": [
      {
        "path": "src/link_policy.go",
        "symbol": "CanonicalRepoPath"
      }
    ]
  },
  "guards": {
    "forbidden_paths": ["escape-link.txt"]
  }
}

